{
    "port": 6799,
    "key": "sk-cr-testkey123",
    "db": "test.db",
    "providers": {
        "mock": {
            "base_url": "http://127.0.0.1:9999/v1",
            "api_key": "sk-mock",
            "models": [
                "mock-1",
                "mock-2"
            ]
        },
        "mock2": {
            "base_url": "http://127.0.0.1:9999/v1",
            "api_key": "sk-mock",
            "models": [
                "mock-1"
            ]
        }
    }
}
